{
  "$schema": "./schemas/plannotator-assets.v1.schema.json",
  "schema_version": 1,
  "name": "plannotator",
  "upstream": {
    "repo": "backnotprop/plannotator"
  },
  "artifacts": [
    {
      "path": "dot_claude/skills/plannotator-annotate/SKILL.md",
      "source_path": "apps/skills/claude/plannotator-annotate/SKILL.md",
      "sha256": "d69c5b012cbeefcedd05970f5f55b5fba5b83d54d9c2a24fd8a3e1286f323b69"
    },
    {
      "path": "dot_claude/skills/plannotator-last/SKILL.md",
      "source_path": "apps/skills/claude/plannotator-last/SKILL.md",
      "sha256": "1a979daa6b39e86706b9e644ab7bd847f53373ecdfd6ec1d06d3d228727dd54d"
    },
    {
      "path": "dot_claude/skills/plannotator-review/SKILL.md",
      "source_path": "apps/skills/claude/plannotator-review/SKILL.md",
      "sha256": "cd4631c42e8cf75ea80b829501bd78a2cf0a7e333e3d97500e6ac2cea8cbc8a5"
    },
    {
      "path": "private_dot_config/opencode/commands/plannotator-annotate.md",
      "source_path": "apps/opencode-plugin/commands/plannotator-annotate.md",
      "sha256": "d7fad3146760872b97668aa4349306d6aabba296179b6f26ed43cdb238e6ab45"
    },
    {
      "path": "private_dot_config/opencode/commands/plannotator-last.md",
      "source_path": "apps/opencode-plugin/commands/plannotator-last.md",
      "sha256": "4e75c2ed1f4623b27e6cc829bfeb565b9b8a12e09bf51d6213b05f1b4fd23f50"
    },
    {
      "path": "private_dot_config/opencode/commands/plannotator-review.md",
      "source_path": "apps/opencode-plugin/commands/plannotator-review.md",
      "sha256": "4393f6523d7fd618a42106cad8fccfede30b184f08985d3ef82bbb8e2b9ca007"
    }
  ]
}
